00:00:00.000000 IP 10.240.10.255.47111 > 74.125.69.95.443: tcp 0
00:00:00.001125 IP 74.125.69.95.443 > 10.240.10.255.47111: tcp 0
00:00:00.000019 IP 10.240.10.255.47111 > 74.125.69.95.443: tcp 0
00:00:00.003627 IP 10.240.10.255.47111 > 74.125.69.95.443: tcp 292
00:00:00.001023 IP 74.125.69.95.443 > 10.240.10.255.47111: tcp 0
00:00:00.001315 IP 74.125.69.95.443 > 10.240.10.255.47111: tcp 3582
00:00:00.000067 IP 10.240.10.255.47111 > 74.125.69.95.443: tcp 0
00:00:00.001418 IP 10.240.10.255.47111 > 74.125.69.95.443: tcp 126
00:00:00.001009 IP 74.125.69.95.443 > 10.240.10.255.47111: tcp 230
00:00:00.000445 IP 10.240.10.255.47111 > 74.125.69.95.443: tcp 391
00:00:00.040517 IP 74.125.69.95.443 > 10.240.10.255.47111: tcp 0
00:00:00.002684 IP 74.125.69.95.443 > 10.240.10.255.47111: tcp 931
00:00:00.009690 IP 10.240.10.255.47111 > 74.125.69.95.443: tcp 0
00:00:00.001282 IP 74.125.69.95.443 > 10.240.10.255.47111: tcp 0
00:00:00.000015 IP 10.240.10.255.47111 > 74.125.69.95.443: tcp 0
